{
  "skeleton_id": "nios-lkg",
  "board_id": "nios",
  "year_id": "lkg",
  "academic_session": "2026-27",
  "nep_stage": "foundational",
  "coverage_status": "not-offered-by-board",
  "certification_point": null,
  "scheme_notes": [],
  "subjects": [],
  "skills": [
    {
      "skill_id": "ed-physical-motor",
      "depth": "domain-only"
    },
    {
      "skill_id": "ed-cognitive",
      "depth": "domain-only"
    },
    {
      "skill_id": "ed-socio-emotional-ethical",
      "depth": "domain-only"
    },
    {
      "skill_id": "ed-cultural-artistic",
      "depth": "domain-only"
    },
    {
      "skill_id": "ed-communication-early-language",
      "depth": "domain-only"
    },
    {
      "skill_id": "ed-literacy-numeracy",
      "depth": "domain-only"
    }
  ],
  "term_plan": {
    "status": "skeleton",
    "basis": "product-default",
    "terms": [
      {
        "term_id": "continuous-year",
        "label_en": "Continuous year (observation-based, no exams)",
        "label_hi": "पूरा वर्ष (अवलोकन आधारित, कोई परीक्षा नहीं)"
      }
    ]
  },
  "weekly_plan": {
    "status": "gap",
    "basis": "not-yet-sourced",
    "weeks_per_year": null,
    "sessions_per_week": null,
    "notes": [
      "Periods per week per subject to come from each board's scheme of studies; product defaults set in Phase 2 where boards are silent."
    ]
  },
  "daily_lesson_template": {
    "status": "skeleton",
    "basis": "product-default",
    "loop": [
      "caregiver-reads-activity-card",
      "hands-on-play",
      "talk-and-name",
      "short-optional-screen-moment",
      "caregiver-logs-observation"
    ],
    "screen_minutes_cap": 15,
    "source_ids": [
      "SRC-WHO-UNDER-5-ACTIVITY-SCREEN-SLEEP-2019"
    ],
    "notes": [
      "15 minutes of child-facing screen per day is a product cap, well inside the WHO 2019 ceiling of 1 hour total sedentary screen time for ages 3-4. WHO's under-5 guideline does not cover age 5-6; same cap applied by product choice."
    ]
  },
  "assessments": {
    "unit_tests": {
      "status": "not-applicable",
      "basis": "product-default",
      "notes": [
        "No tests before Class 1; progress is tracked through caregiver and teacher observation."
      ]
    },
    "internals": {
      "status": "skeleton",
      "basis": "product-default",
      "notes": [
        "Observation log against development domains."
      ]
    },
    "term_exams": {
      "status": "not-applicable",
      "basis": "product-default",
      "notes": [
        "No tests before Class 1; progress is tracked through caregiver and teacher observation."
      ]
    },
    "board_style_mocks": {
      "status": "not-applicable",
      "basis": "product-default",
      "notes": [
        "No tests before Class 1; progress is tracked through caregiver and teacher observation."
      ],
      "applicable": false
    }
  },
  "co_curricular": {
    "status": "skeleton",
    "basis": "national-framework",
    "areas": [
      "art-and-craft",
      "music-and-movement",
      "free-and-guided-play",
      "storytelling"
    ],
    "source_ids": [
      "SRC-PIB-POSHAN-BHI-PADHAI-BHI"
    ],
    "notes": [
      "Areas mirror the cultural/artistic and physical/motor development domains."
    ]
  },
  "extracurricular": {
    "status": "skeleton",
    "basis": "product-default",
    "areas": [
      "outdoor-play",
      "family-activities",
      "neighbourhood-walks"
    ],
    "notes": [
      "In-person peer activities are included on purpose to address the social learning risk."
    ]
  },
  "parent_view": {
    "status": "skeleton",
    "basis": "product-default",
    "sections": [
      "this-week",
      "skill-progress",
      "observations-and-milestones",
      "screen-time",
      "what-to-do-at-home",
      "consent-and-data"
    ]
  },
  "source_ids": [
    "SRC-NIOS-SDMIS-OBE"
  ],
  "gaps": [
    {
      "gap_id": "G-NIOS-LKG-PREPARATION-YEAR",
      "missing": "NIOS does not cover pre-school years; learners use national-early-years",
      "resolve_from": "data/curriculum/national-early-years",
      "phase": "phase-3"
    },
    {
      "gap_id": "G-NIOS-LKG-UNITS",
      "missing": "Unit and chapter level content and learning outcomes for this year",
      "resolve_from": "NIOS prospectus and self-learning material for the level",
      "phase": "phase-3"
    },
    {
      "gap_id": "G-NIOS-LKG-PERIODS",
      "missing": "Periods or sessions per week per subject",
      "resolve_from": "Board scheme of studies; product default where the board is silent",
      "phase": "phase-2"
    }
  ],
  "generated_by": "scripts/generate-curriculum-skeletons.mjs",
  "built_on": "2026-10-21"
}
