{
  "skeleton_id": "cbse-class-04",
  "board_id": "cbse",
  "year_id": "class-04",
  "academic_session": "2026-27",
  "nep_stage": "preparatory",
  "coverage_status": "partially-sourced",
  "certification_point": null,
  "scheme_notes": [],
  "subjects": [
    {
      "status": "partially-sourced",
      "source_ids": [
        "SRC-NCERT-TEXTBOOK-INDEX",
        "SRC-NCERT-PRICE-LIST-2025",
        "SRC-CBSE-CIRC-ACAD-12-2025"
      ],
      "subject_id": "english",
      "name_en": "English",
      "name_hi": "अंग्रेज़ी",
      "name_hi_basis": "ui-translation",
      "skill_ids": [
        "lang-english"
      ],
      "ncert_textbook_titles": [
        "Santoor"
      ],
      "ncert_hindi_medium_titles": [],
      "language_slot": "any",
      "notes": []
    },
    {
      "status": "partially-sourced",
      "source_ids": [
        "SRC-NCERT-TEXTBOOK-INDEX",
        "SRC-NCERT-PRICE-LIST-2025",
        "SRC-CBSE-CIRC-ACAD-12-2025"
      ],
      "subject_id": "hindi",
      "name_en": "Hindi",
      "name_hi": "हिंदी",
      "name_hi_basis": "ui-translation",
      "skill_ids": [
        "lang-hindi"
      ],
      "ncert_textbook_titles": [
        "Veena"
      ],
      "ncert_hindi_medium_titles": [],
      "language_slot": "any",
      "notes": []
    },
    {
      "status": "partially-sourced",
      "source_ids": [
        "SRC-NCERT-TEXTBOOK-INDEX",
        "SRC-NCERT-PRICE-LIST-2025",
        "SRC-CBSE-CIRC-ACAD-12-2025"
      ],
      "subject_id": "mathematics",
      "name_en": "Mathematics",
      "name_hi": "गणित",
      "name_hi_basis": "ui-translation",
      "skill_ids": [
        "area-mathematics"
      ],
      "ncert_textbook_titles": [
        "Math-Mela"
      ],
      "ncert_hindi_medium_titles": [
        "Ganit Mela"
      ],
      "notes": []
    },
    {
      "status": "partially-sourced",
      "source_ids": [
        "SRC-NCERT-TEXTBOOK-INDEX",
        "SRC-NCERT-PRICE-LIST-2025",
        "SRC-CBSE-CIRC-ACAD-12-2025"
      ],
      "subject_id": "the-world-around-us",
      "name_en": "The World Around Us",
      "name_hi": "हमारे आसपास की दुनिया",
      "name_hi_basis": "ui-translation",
      "skill_ids": [
        "area-world-around-us"
      ],
      "ncert_textbook_titles": [
        "Our Wonderous World"
      ],
      "ncert_hindi_medium_titles": [
        "Hamara Adhbhut Sansar"
      ],
      "notes": []
    },
    {
      "status": "partially-sourced",
      "source_ids": [
        "SRC-NCERT-TEXTBOOK-INDEX",
        "SRC-NCERT-PRICE-LIST-2025",
        "SRC-CBSE-CIRC-ACAD-12-2025"
      ],
      "subject_id": "arts",
      "name_en": "Arts",
      "name_hi": "कला",
      "name_hi_basis": "ui-translation",
      "skill_ids": [
        "area-arts"
      ],
      "ncert_textbook_titles": [
        "Bansuri"
      ],
      "ncert_hindi_medium_titles": [
        "Bansuri - I (Hindi)"
      ],
      "notes": []
    },
    {
      "status": "partially-sourced",
      "source_ids": [
        "SRC-NCERT-TEXTBOOK-INDEX",
        "SRC-NCERT-PRICE-LIST-2025",
        "SRC-CBSE-CIRC-ACAD-12-2025"
      ],
      "subject_id": "physical-education-wellbeing",
      "name_en": "Physical Education and Well Being",
      "name_hi": "शारीरिक शिक्षा और कल्याण",
      "name_hi_basis": "ui-translation",
      "skill_ids": [
        "area-physical-education-wellbeing"
      ],
      "ncert_textbook_titles": [
        "Khel Yoga"
      ],
      "ncert_hindi_medium_titles": [
        "Khel Yoga(Hindi)"
      ],
      "notes": []
    }
  ],
  "skills": [
    {
      "skill_id": "lang-english",
      "depth": "domain-only"
    },
    {
      "skill_id": "lang-hindi",
      "depth": "domain-only"
    },
    {
      "skill_id": "area-mathematics",
      "depth": "domain-only"
    },
    {
      "skill_id": "area-world-around-us",
      "depth": "domain-only"
    },
    {
      "skill_id": "area-arts",
      "depth": "domain-only"
    },
    {
      "skill_id": "area-physical-education-wellbeing",
      "depth": "domain-only"
    }
  ],
  "term_plan": {
    "status": "skeleton",
    "basis": "product-default",
    "terms": [
      {
        "term_id": "term-1",
        "label_en": "Term 1",
        "label_hi": "सत्र 1"
      },
      {
        "term_id": "term-2",
        "label_en": "Term 2",
        "label_hi": "सत्र 2"
      }
    ],
    "notes": [
      "Two-term split is a product default until each board's academic calendar guidance is ingested."
    ]
  },
  "weekly_plan": {
    "status": "gap",
    "basis": "not-yet-sourced",
    "weeks_per_year": null,
    "sessions_per_week": null,
    "notes": [
      "Periods per week per subject to come from each board's scheme of studies; product defaults set in Phase 2 where boards are silent."
    ]
  },
  "daily_lesson_template": {
    "status": "skeleton",
    "basis": "product-default",
    "loop": [
      "recall-warm-up",
      "new-idea",
      "worked-example",
      "guided-practice",
      "independent-practice",
      "exit-check",
      "offline-practice-task"
    ],
    "screen_minutes_cap": null,
    "source_ids": [],
    "notes": [
      "School-age screen cap is guardian-set; Phase 2 decides the product default."
    ]
  },
  "assessments": {
    "unit_tests": {
      "status": "skeleton",
      "basis": "product-default",
      "notes": [
        "One short unit check per unit once units are ingested."
      ]
    },
    "internals": {
      "status": "gap",
      "basis": "not-yet-sourced",
      "notes": [
        "Board internal-assessment components and weights not yet ingested."
      ]
    },
    "term_exams": {
      "status": "skeleton",
      "basis": "product-default",
      "source_ids": [],
      "notes": []
    },
    "board_style_mocks": {
      "status": "not-applicable",
      "basis": "product-default",
      "applicable": false
    }
  },
  "co_curricular": {
    "status": "partially-sourced",
    "basis": "board-mandated",
    "areas": [
      "Arts",
      "Physical Education and Well Being"
    ],
    "source_ids": [
      "SRC-NCERT-TEXTBOOK-INDEX"
    ],
    "notes": [
      "Listed areas have official NCERT textbooks for this class."
    ]
  },
  "extracurricular": {
    "status": "skeleton",
    "basis": "product-default",
    "areas": [
      "clubs",
      "sports",
      "competitions-and-olympiads",
      "community-service",
      "reading-programme",
      "in-person-peer-group"
    ],
    "notes": [
      "In-person peer activities are included on purpose to address the social learning risk."
    ]
  },
  "parent_view": {
    "status": "skeleton",
    "basis": "product-default",
    "sections": [
      "this-week",
      "skill-progress",
      "assessments-and-feedback",
      "screen-time",
      "what-to-do-at-home",
      "consent-and-data"
    ]
  },
  "source_ids": [
    "SRC-NCERT-TEXTBOOK-INDEX",
    "SRC-NCERT-PRICE-LIST-2025",
    "SRC-CBSE-CIRC-ACAD-12-2025"
  ],
  "gaps": [
    {
      "gap_id": "G-CBSE-CLASS-04-UNITS",
      "missing": "Unit and chapter level content and learning outcomes for this year",
      "resolve_from": "NCERT textbook contents and NCERT learning outcomes",
      "phase": "phase-3"
    },
    {
      "gap_id": "G-CBSE-CLASS-04-PERIODS",
      "missing": "Periods or sessions per week per subject",
      "resolve_from": "Board scheme of studies; product default where the board is silent",
      "phase": "phase-2"
    },
    {
      "gap_id": "G-CBSE-CLASS-04-INTERNALS",
      "missing": "Internal assessment components and weightage",
      "resolve_from": "Board curriculum or assessment framework document",
      "phase": "phase-3"
    }
  ],
  "generated_by": "scripts/generate-curriculum-skeletons.mjs",
  "built_on": "2026-10-21"
}
