{
  "skeleton_id": "cisce-class-12",
  "board_id": "cisce",
  "year_id": "class-12",
  "academic_session": "2026-27",
  "nep_stage": "secondary",
  "coverage_status": "gap",
  "certification_point": "Class XII board examination",
  "scheme_notes": [
    {
      "text": "CISCE has published ISC Regulations and Syllabuses for the 2027 examination; the ISC 2028 listing was not confirmed on the official page.",
      "source_ids": [
        "SRC-CISCE-PUBLICATIONS"
      ]
    }
  ],
  "subjects": [],
  "skills": [
    {
      "skill_id": "lang-english",
      "depth": "domain-only"
    },
    {
      "skill_id": "lang-hindi",
      "depth": "domain-only"
    },
    {
      "skill_id": "area-mathematics",
      "depth": "domain-only"
    },
    {
      "skill_id": "ss-physics",
      "depth": "domain-only"
    },
    {
      "skill_id": "ss-chemistry",
      "depth": "domain-only"
    },
    {
      "skill_id": "ss-biology",
      "depth": "domain-only"
    },
    {
      "skill_id": "ss-accountancy",
      "depth": "domain-only"
    },
    {
      "skill_id": "ss-business-studies",
      "depth": "domain-only"
    },
    {
      "skill_id": "ss-economics",
      "depth": "domain-only"
    },
    {
      "skill_id": "ss-history",
      "depth": "domain-only"
    },
    {
      "skill_id": "ss-geography",
      "depth": "domain-only"
    },
    {
      "skill_id": "ss-political-science",
      "depth": "domain-only"
    },
    {
      "skill_id": "area-physical-education-wellbeing",
      "depth": "domain-only"
    }
  ],
  "term_plan": {
    "status": "skeleton",
    "basis": "product-default",
    "terms": [
      {
        "term_id": "term-1",
        "label_en": "Term 1",
        "label_hi": "सत्र 1"
      },
      {
        "term_id": "term-2",
        "label_en": "Term 2",
        "label_hi": "सत्र 2"
      }
    ],
    "notes": [
      "Two-term split is a product default until each board's academic calendar guidance is ingested."
    ]
  },
  "weekly_plan": {
    "status": "gap",
    "basis": "not-yet-sourced",
    "weeks_per_year": null,
    "sessions_per_week": null,
    "notes": [
      "Periods per week per subject to come from each board's scheme of studies; product defaults set in Phase 2 where boards are silent."
    ]
  },
  "daily_lesson_template": {
    "status": "skeleton",
    "basis": "product-default",
    "loop": [
      "recall-warm-up",
      "new-idea",
      "worked-example",
      "guided-practice",
      "independent-practice",
      "exit-check",
      "offline-practice-task"
    ],
    "screen_minutes_cap": null,
    "source_ids": [],
    "notes": [
      "School-age screen cap is guardian-set; Phase 2 decides the product default."
    ]
  },
  "assessments": {
    "unit_tests": {
      "status": "skeleton",
      "basis": "product-default",
      "notes": [
        "One short unit check per unit once units are ingested."
      ]
    },
    "internals": {
      "status": "gap",
      "basis": "not-yet-sourced",
      "notes": [
        "Board internal-assessment components and weights not yet ingested."
      ]
    },
    "term_exams": {
      "status": "skeleton",
      "basis": "product-default",
      "source_ids": [],
      "notes": []
    },
    "board_style_mocks": {
      "status": "gap",
      "basis": "not-yet-sourced",
      "applicable": true,
      "notes": [
        "Certification year (Class XII board exam). Paper pattern and marking scheme to be ingested from the board before mocks are generated."
      ]
    }
  },
  "co_curricular": {
    "status": "gap",
    "basis": "not-yet-sourced",
    "areas": [],
    "notes": [
      "Board co-curricular requirements for this year not yet sourced."
    ]
  },
  "extracurricular": {
    "status": "skeleton",
    "basis": "product-default",
    "areas": [
      "clubs",
      "sports",
      "competitions-and-olympiads",
      "community-service",
      "reading-programme",
      "in-person-peer-group"
    ],
    "notes": [
      "In-person peer activities are included on purpose to address the social learning risk."
    ]
  },
  "parent_view": {
    "status": "skeleton",
    "basis": "product-default",
    "sections": [
      "this-week",
      "skill-progress",
      "assessments-and-feedback",
      "screen-time",
      "what-to-do-at-home",
      "consent-and-data"
    ]
  },
  "source_ids": [
    "SRC-CISCE-PUBLICATIONS"
  ],
  "gaps": [
    {
      "gap_id": "G-CISCE-CLASS-12-SUBJECTS",
      "missing": "Official CISCE subject list and groups for this year not yet ingested (cisce.org blocked from build environment); skills mapped from NEP stage via the shared graph",
      "resolve_from": "cisce.org Regulations and Syllabuses, fetched from an unblocked network",
      "phase": "phase-3"
    },
    {
      "gap_id": "G-CISCE-CLASS-12-UNITS",
      "missing": "Unit and chapter level content and learning outcomes for this year",
      "resolve_from": "CISCE Regulations and Syllabuses (ICSE 2028, ISC 2028) PDFs",
      "phase": "phase-3"
    },
    {
      "gap_id": "G-CISCE-CLASS-12-PERIODS",
      "missing": "Periods or sessions per week per subject",
      "resolve_from": "Board scheme of studies; product default where the board is silent",
      "phase": "phase-2"
    },
    {
      "gap_id": "G-CISCE-CLASS-12-INTERNALS",
      "missing": "Internal assessment components and weightage",
      "resolve_from": "Board curriculum or assessment framework document",
      "phase": "phase-3"
    }
  ],
  "generated_by": "scripts/generate-curriculum-skeletons.mjs",
  "built_on": "2026-10-21"
}
